{
  "UNDERHEART": {"timeAdd": 300, "kxp": 120, "relicBoss": 2, "relicChest": 0.5},
  "ENDINGS": {
    "wake": {"name": "Wake", "title": "Waker of the Bloom", "col": "#ffcf4a",
      "desc": "Wake the Bloom and let it see the healed world. It opens its arms: everything it kept comes out to play, and it plays rough.",
      "unbound": {"wild": 1.6, "hp": 1.1, "desc": "Wild creatures turn up 60% more often, and enemies have 10% more health."}},
    "sever": {"name": "Sever", "title": "Tethercutter", "col": "#ff5ca8",
      "desc": "Cut the tether. Nothing the Bloom keeps will regrow again, and nothing it holds can be held against its will.",
      "unbound": {"coin": 1.3, "dmg": 1.15, "desc": "Coin from the Bloom is 30% richer, and enemies hit 15% harder."}},
    "sing": {"name": "Sing", "title": "Last Singer", "col": "#9b7bff",
      "desc": "Take Ilsa's place in the song and sing the Bloom back to sleep, gently this time.",
      "unbound": {"sleep": true, "hp": 1.2, "desc": "Enemies doze until they hear you, but wake with 20% more health."}}
  },
  "UNBOUND": {
    "tiers": 20, "floors": [7, 9], "lordFrom": 10, "lordChance": 0.35,
    "coinPerTier": 0.08, "kxpPerTier": 0.06, "apexShards": [1, 0.2], "bloomscarFrom": 8, "renownPerTier": 25,
    "rules": [
      {"id": "hardened", "name": "Hardened", "desc": "Enemies have 15% more health."},
      {"id": "quickened", "name": "Quickened", "desc": "Enemy bullets fly 20% faster."},
      {"id": "brittlecages", "name": "Brittle Cages", "desc": "Cages fail 25% of the time."},
      {"id": "ricochet", "name": "Ricochet", "desc": "Enemy bullets split in two when they hit a wall."},
      {"id": "thinblood", "name": "Thin Blood", "desc": "All healing is 30% weaker."},
      {"id": "twisted", "name": "Twisted Rooms", "desc": "Every fight room has a room twist."},
      {"id": "eliteguard", "name": "Elite Guard", "desc": "Every room's first enemy is an elite."},
      {"id": "nopeddlers", "name": "No Peddlers", "desc": "No peddlers set up shop."},
      {"id": "shortnight", "name": "Short Night", "desc": "Two minutes less on the clock."},
      {"id": "lordsstir", "name": "Bloomlords Stir", "desc": "A Bloomlord may wait at the bottom instead of a boss."},
      {"id": "regrowth", "name": "Regrowth", "desc": "Enemies regrow 1% of their health a second."},
      {"id": "darkness", "name": "Darkness", "desc": "The Hollow Choir's dark falls on every floor."},
      {"id": "gales", "name": "Gales", "desc": "Wind lanes blow through every room."},
      {"id": "venomtide", "name": "Venom Tide", "desc": "Poison pools seep into every room."},
      {"id": "eruptions", "name": "Eruptions", "desc": "Lava vents open in every room."},
      {"id": "fury", "name": "Fury", "desc": "Enemies deal 25% more damage."},
      {"id": "fragile", "name": "Fragile Bonds", "desc": "Companions take 20% more damage."},
      {"id": "barren", "name": "Barren", "desc": "Chests hold half as much."},
      {"id": "swarm", "name": "Swarm", "desc": "Two more enemies in every room."},
      {"id": "unbound", "name": "Unbound", "desc": "Everything has 25% more health and hits 25% harder."}
    ]
  },
  "LORDS": {
    "deaf": {"gunMul": 0.3, "hear": 520, "desc": "Guns do 30% damage; companions and melee do full."},
    "reflect": {"frac": 0.5, "desc": "Half of every elemental hit comes back on whoever applied it."},
    "brood": {"desc": "Can't be hurt while any of its brood lives."},
    "mirror": {"hp": 1.2, "desc": "Sends shadow copies of your companions in first, again when enraged."}
  },
  "TOOLS": {
    "splicer": {"rank": 25, "cost": {"coin": 400, "serum": 1}},
    "mutlab": {"rank": 25, "slots": 2, "per": 0.01, "cap": 0.02},
    "apex": {"cost": {"apexshard": 1}}
  },
  "ARCHIVE": {"perDay": 1},
  "RUNES": {
    "alphabet": "ᚨᛒᚲᛞᛖᚠᚷᚺᛁᛃᚴᛚᛗᚾᛟᛈᛩᚱᛋᛏᚢᚡᚹᛪᛇᛉ"
  },
  "RENOWN": {"tier": 25, "deepeningTop": [120, 60, 30], "apex": 40, "ribbon": [30, 15, 8], "hybridHatched": 4, "recipeMastered": 10, "legendary": 25, "milestone": 15, "relic": 5, "ending": 100, "ilsa": 150},
  "SHOWS": {
    "every": 7, "rivals": 5, "rivalScore": [0.55, 0.95],
    "classes": [
      {"id": "finest", "name": "Finest {type} genome", "desc": "The highest total of combat grades."},
      {"id": "gene", "name": "Highest {gene} {type}", "desc": "The highest {gene}."},
      {"id": "young", "name": "Best {type} under Gen {n}", "desc": "Total grades, for a creature below Gen {n}.", "gen": [3, 6]},
      {"id": "looks", "name": "Most striking {type}", "desc": "Rare looks: shine, pattern, size and hue."}
    ]
  },
  "DEEPENING": {"rivals": 99, "score": {"floor": 1000, "kill": 10, "coin": 1, "extract": 2500, "caught": 150}, "rivalMean": 4200, "rivalSpread": 2600},
  "SEASON": {
    "days": 90,
    "twists": [
      {"name": "Season of Tides", "desc": "Tide creatures turn up twice as often.", "type": "tide"},
      {"name": "Season of Embers", "desc": "Ember creatures turn up twice as often.", "type": "ember"},
      {"name": "Season of Glass", "desc": "Crystal creatures turn up twice as often.", "type": "crystal"},
      {"name": "Season of Song", "desc": "Echo creatures turn up twice as often.", "type": "echo"}
    ],
    "awards": [{"renown": 2000, "title": "Gold Keeper"}, {"renown": 900, "title": "Silver Keeper"}, {"renown": 300, "title": "Bronze Keeper"}]
  }
}
